start_date,summary,latitude,longitude,marker_color
8/30/13,"2 suspected LRA forces were sighted several times over the course of 2 days. They indicated their will to defect to one civilian, but fled before security forces arrived. These sightings occurred 7 km north of Dungu, DRC.",3.687,28.52,#2563A3
2/25/13,"6 suspected LRA forces ambushed  2 merchants on motorcycles 15 km east of Nagero, DRC. Both merchants managed to escape, leaving the assailants to take their motorcycle batteries and merchandise.",3.6875,29.409,#2563A3
2/8/13,"A 15-year-old boy was released from LRA forces south of Masabe, DRC, by the Dungu river. He reported that he had been abducted in Niangara years earlier.",3.6878,29.1007,#2563A3
7/22/11,"LRA combatants were seen walking a road near Dungu, DRC on July 22nd. Some were armed and wore military uniforms.",3.688,28.562,#2563A3
8/23/11,"A man and a woman are presumed abducted by LRA forces after disappearing while traveling  through a small community known as Mangasaba, DRC, on Aug 23. Their motorcycle and the man's belt was found one week later with no sign of the travelers.",3.6882,29.4265,#2563A3
8/24/11,"While traveling by motorcycle, a man, pregnant woman, and a young child disappeared near Mangasaba, DRC. This is the second incident of missing travelers in Mangasaba during the week of Aug 24th.",3.6882,29.4265,#2563A3
8/29/11,"A man abducted by suspected LRA on August 24 at Mangasaba, DRC, was found dead and his body mutilated. The woman and child who were abducted at the same time are still missing.",3.6882,29.4265,#2563A3
3/21/12,"LRA forces released a 15 year old boy and a woman a few hours after their abduction near Mangasaba, DRC.",3.6882,29.4265,#2563A3
3/21/12,"9 LRA forces abducted a 15-year-old boy and a woman near Mangasaba, DRC and looted all of their belongings, including fish and civilian clothing. They were reportedly in captivity for only a few hours.",3.6882,29.4265,#2563A3
12/13/11,"30 suspected LRA, including men, women, and children, looted a truck en route to Nagero, DRC, on December 13th, 2011. No injuries were reported, but the driver is missing.",3.6883,29.4074,#2563A3
2/24/13,"4 armed LRA men and 3 boys stopped 6 people who were traveling the Dungu-Faradje road in the DRC. Once stopped, 2 of the passengers escaped. The LRA forces proceeded to loot the vehicle and abducted the 4 remaining civilians, including a 13-year-old girl.",3.68865,29.40003,#2563A3
3/19/13,"4 LRA forces ambushed 2 men near the Nangume river along the Dungu-Faradje road in the DRC. 1 man was able to escape, but the other was captured and had food, clothing, and other items looted from him before he was released.",3.68865,29.40003,#2563A3
1/16/13,"A civilian sighted suspected LRA forces comprised of 6 armed men, 2 children, 4 women and 1 baby crossing the road around the community of Route 4, DRC. Security forces were unable to follow the group as they set fire to the bush to cover their tracks.",3.6887,29.3889,#2563A3
11/1/13,"A sick Congolese woman with a 3-year-old child escaped in early November from the LRA to Route 4, DRC, after 4 years in captivity. She had been abducted from Masombo or Kpanangbala. Security forces picked her up upon her escape.",3.6887,29.3889,#2563A3
11/4/08,"As reported on November 4th, 2008, LRA forces attacked Linakofo, DRC, leading to a mass displacement of the population towards Dungu, DRC. This attack happened sometime before the major attack in Dungu on November 1st, 2008.",3.6889,28.6133,#2563A3
1/13/10,"In an attack on Linakofo, DRC, on January 13th, 2010, LRA forces killed 2 people and abducted 10 others.",3.6889,28.6133,#2563A3
1/24/10,"35 LRA members attacked Linakofo, DRC on January 24th, 2010. They burned down and looted homes.",3.6889,28.6133,#2563A3
1/26/10,"As reported on January 26, 2010, 7 LRA members were seen near Linakofo, DRC.",3.6889,28.6133,#2563A3
3/27/10,"A girl escaped from suspected LRA forces on March 27th, 2010, near Linakofo, DRC.",3.6889,28.6133,#2563A3
3/27/10,"Suspected LRA forces attacked Linakofo, DRC on March 27th, 2010 and abducted 1 girl.",3.6889,28.6133,#2563A3
3/27/10,"LRA forces abducted 3 children from Linakofo, DRC, on March 27th, 2010.",3.6889,28.6133,#2563A3
4/27/10,"LRA forces abducted 1 girl on April 27th, 2010 at Linakofo, DRC. She was rescued 2 days later.",3.6889,28.6133,#2563A3
6/8/10,"LRA members looted various goods from Linakofo, DRC.",3.6889,28.6133,#2563A3
6/20/10,"LRA forces attacked Linakofo, DRC on June 20th, 2010 and seriously wounded a civilian.",3.6889,28.6133,#2563A3
6/30/10,"LRA forces were reported near Linakofo, DRC.",3.6889,28.6133,#2563A3
12/8/10,"7 LRA combatants entered Linakofo, DRC, and abducted 2 boys, aged 8 and 10. The LRA combatants were traced by regional security forces who lost track of them the next morning.",3.6889,28.6133,#2563A3
3/11/14,"A group of 9 armed suspected LRA forces speaking a poor Lingala attempted to abduct 3 fishermen near Niangara, DRC. 2 of the fishermen managed to escape, but 1 fisherman remains in captivity. He is reportedly around 27-years-old.",3.689583,27.990323,#2563A3
7/24/08,"At an unclear point in time between the 24th and 26th of July, 2008, LRA forces killed approximately 20 civilians during an attack on Niangara, DRC. This attack was followed by a clash with security forces.",3.69014,27.88888,#2563A3
6/24/09,"LRA forces reportedly killed 20 men, women, and children in Niangara, DRC. Security forces also clashed with the LRA during this attack.",3.69014,27.88888,#2563A3
8/12/11,"Shortly after their abduction, a pregnant woman and a 6 months old baby were released by LRA forces. The mother of the baby is reportedly still in captivity.",3.69014,27.88888,#2563A3
8/12/11,"3 suspected LRA forces abducted 2 women, one of them reportedly pregnant, in Niangara, DRC. The other woman had a 6 month-old baby with her.",3.69014,27.88888,#2563A3
11/30/13,"A 12-year-old boy who was abducted 5 days previously escaped LRA captivity and arrived in Niangara, DRC, on November 30, 2013.  The boy reportedly buried the weapon given to him before escaping. He is currently with local security forces.",3.69014,27.88888,#2563A3
2/11/12,"A 12-year-old girl escaped from LRA forces and was found off the main road near Nagero, DRC. She had been abducted a month earlier on January 8th near Djabir, DRC.",3.6912,29.5349,#2563A3
2/9/12,"Near Nagero, DRC, a security force member sighted 4 armed suspected LRA men several meters away. He asked them what they were doing and they began shooting at him. He returned their fire and fled to inform others.",3.69365,29.44572,#2563A3
12/21/10,"LRA combatants stopped and looted a toyota pick-up along the road from Dungu to Faradje, DRC.",3.694,29.443,#2563A3
12/31/12,"On December 31st, 2012, 7 suspected armed LRA forces comprised of 5 men in uniforms, 1 man in civilian clothes and 1 woman - attempted to attack a civilian coach east of Nangume, DRC, but fled when they saw security forces were on board.",3.695,29.374,#2563A3
3/27/13,"3 men were ambushed and abducted by 10 LRA forces comprised of 5 armed men, 2 women, 2 boys, and a 12-year-old girl. The men were fishing at the Nazambaime and Dungu river confluence north of Gangala na Bodio, DRC.",3.6962,29.1446,#2563A3
3/28/13,"A day after their abduction by 10 LRA forces and being forced to help loot a truck along the Dungu-Faradje road in the DRC, the 3 men were taken back to where they were abducted and released with 2 phones and 7,000 Ugandan shillings.",3.6962,29.1446,#2563A3
2/10/12,"5 suspected LRA released a woman abducted on February 9th near Nagero, DRC. The assailants kept her clothes.",3.6968,29.4812,#2563A3
5/9/09,"LRA forces entered a village near Gangala na Bodio, DRC on May 9th, 2009. Civilians then alerted security forces who responded and clashed with the LRA forces.",3.697,29.29,#2563A3
8/10/11,"2 women escaped from LRA forces after being abducted earlier that day near Nagero, DRC.",3.6974,29.4749,#2563A3
7/1/11,"In the late hours of July 1st, 6 businessmen were attacked by LRA forces near Faradje, DRC. The man who was leading the group was shot and killed instantly. The 5 others were wounded but able to escape. Their goods were stolen.",3.6979,29.4549,#2563A3
7/20/13,"Suspected LRA forces abducted 4 civilians and looted various crops during an attack at Masabe, DRC.",3.701,29.1,#2563A3
2/10/11,"LRA forces attacked the community of Motoba near Faradje in the DRC, killing 1 woman and abducting 3 boys and 2 girls.",3.70196,29.71639,#2563A3
2/9/12,"Near Nagero, DRC, 5 suspected LRA abducted a woman cooking sweet potatoes in a field. The woman was forced to show the men the closest home, which was 3 km away, so they could loot food. 2 other women were also reportedly raped by the group.",3.7028,29.4926,#2563A3
1/15/10,"LRA combatants allegedly killed 1 civilian in Apudu, DRC on January 15, 2010.",3.705,28.565,#2563A3
12/16/09,"LRA forces attacked a group of travelers at the Duru Bridge, northwest of Dungu, DRC, but all were able to escape.",3.7062,28.1918,#2563A3
7/12/10,"Along the road from Dungu, DRC to Ngilima, DRC suspected LRA combatants attacked and killed 2 civilians. Date and plotted location are approximate.",3.707,28.444,#2563A3
1/25/10,"LRA forces and security forces clashed north of Dungu, DRC. 10 LRA members were injured and 5 abductees were released.",3.707,28.567,#2563A3
12/11/10,"LRA forces abducted 4 boys during an attack near Niangara, DRC.",3.709,27.865,#2563A3
12/12/10,"The 4 boys abducted by LRA forces the day before escaped and returned home near Niangara, DRC.",3.709,27.865,#2563A3
8/30/09,"LRA forces clashed with security forces in Gangala na Bodio between August 30th and September 2nd, 2009.",3.7101,29.28727,#2563A3
1/27/10,"On January 27th, 2010, LRA members attacked Quartier Zande, DRC killing 2 people, wounding 1 person, and lighting houses on fire.",3.7111,27.8883,#2563A3
4/13/10,"A woman who'd been abducted by LRA forces was brutally tortured in captivity in Quartier Zande, DRC. They clasped her lips together with pliers and then forced a young captive to cut off her lips and one of her ears. She was released 5 days later.",3.7111,27.8883,#2563A3
4/13/10,"At least 1 woman was abducted by LRA members on April 13th, 2010 at Quartier Zande, DRC. She was later horribly mutilated in captivity and then released.",3.7111,27.8883,#2563A3
4/18/10,"After being abducted from Quartier Zande, DRC and mutilated, a young woman was released by LRA members on April 18th, 2010.",3.7111,27.8883,#2563A3
3/24/14,"A group of 14 suspected LRA forces abducted a Congolese man and looted food and non-food items from 11 households in the community of Wawe, near Niangara, DRC.",3.7113,27.9111,#2563A3
5/5/09,"LRA forces abducted 1 teenage boy from Kaka, DRC on May 5th, 2009.  He was then used as a combatant and was able to escape in December 2009.",3.71196,28.42062,#2563A3
1/4/10,"LRA members abducted 3 people in Kakalika, DRC, on January, 4th, 2010.",3.71196,28.42062,#2563A3
1/9/10,"7 LRA forces abducted at least 6 civilians from Kaka and Nangwende, DRC and the surrounding fields on January 9th. An unspecified, but short number days later, 5 of the abductees were executed.",3.71196,28.42062,#2563A3
1/11/10,"Several days after being abducted from Kaka, DRC by the LRA, 5 of 6 abductees were executed on the way to a camp near the intersection of the Uele and Duru rivers. This date is an approximation.",3.71196,28.42062,#2563A3
1/12/10,"LRA forces abducted at least 1 civilian on January 12th, 2010 at Kaka, DRC.",3.71196,28.42062,#2563A3
1/21/10,"LRA members killed 2 civilians on January 21st, 2010 in Kaka II, DRC.",3.71196,28.42062,#2563A3
3/24/10,"LRA members attempted to abduct 2 women traveling with 1 security force member near Kaka, DRC on March 24th, 2010. During the clash, the 2 women were able to run away.",3.71196,28.42062,#2563A3
3/26/10,"Near the village of Kaka I, DRC the LRA forces killed the young man they had abducted from Bamokandi, DRC several days earlier.",3.71196,28.42062,#2563A3
4/29/10,"Security forces rescued 1 LRA abductee on April 29th, 2010, at Kaka, DRC.",3.71196,28.42062,#2563A3
10/28/10,"Suspected LRA forces ambushed 3 civilians in Kaka, DRC. 1 escaped and the other 2 were abducted.",3.71196,28.42062,#2563A3
11/12/10,"8 LRA were sighted near the security force checkpoint outside of Dungu, DRC on both November 11th and 12th.",3.71196,28.42062,#2563A3
1/25/11,"Between January 25th-27th, LRA forces stole property and bicycles belonging to 5 people. This incident happened in Kaka, DRC.",3.71196,28.42062,#2563A3
12/14/11,"Suspected LRA ambushed 7 cyclists traveling to Dungu, DRC. The combatants looted 6 of the 7 cyclists' belongings.",3.713,29.59,#2563A3
5/30/09,"Security forces and LRA members clashed near Gangala na Bodio and Masebe, DRC. The exact date is unknown. 2 LRA members were killed.",3.71352,29.28131,#2563A3
10/4/09,"LRA forces raided Gangala na Bodio, DRC between October 4th and October 10th, 2009.",3.71352,29.28131,#2563A3
1/9/11,"A trader who had been abducted near Gangala na Bodio, DRC, earlier in the day escaped when security forces clashed with the group in response to the attack.",3.71352,29.28131,#2563A3
2/25/12,"A man, abducted on February 22nd by 40 LRA, was released unharmed near Gangala na Bodio, DRC. He is currently with family members in the area.",3.71352,29.28131,#2563A3
3/6/12,"4 LRA combatants ambushed 1 merchant, near Gangala na Bodio, DRC. The result of this attack is unreported. This is the same group that abducted a hunter earlier in the day.",3.71352,29.28131,#2563A3
4/18/12,"A 57-year-old fisherman escaped from LRA captivity after he was abducted a day earlier near Gangala na Bodio, DRC.",3.71352,29.28131,#2563A3
5/13/12,"An LRA spy, dressed in civilian clothing, came out of the forest to ask civilians about recent food distribution. Because of his strange behavior, he was apprehended by security forces and then led them into the forest to find the rest of his group.",3.71352,29.28131,#2563A3
2/1/13,"9-year-old twin brothers, who were abducted on January 6th by suspected LRA forces, escaped  to Gangala na Bodio, DRC, after 3 days of wandering in the bush.",3.71352,29.28131,#2563A3
4/23/10,"In an clash between security forces and LRA forces at Mawe, DRC, 2 LRA members were killed and 2 more LRA members were captured.",3.7142,27.8473,#2563A3
12/30/11,"LRA combatants released 4 men near the Dungu-Faradje Road in DRC. These men were abducted the previous day, December 29th 2011. GPS approximate.",3.715,29.305,#2563A3
2/13/08,"Confirmed LRA forces killed a local leader in Naguga territory, DRC, while in movement towards CAR in the early morning of February 13th, 2008.",3.7176,28.5583,#2563A3
1/23/10,"LRA forces attacked Naguga, DRC and abducted 1 person.",3.7176,28.5583,#2563A3
2/13/10,"Of the 3 men abducted by LRA combatants on February 13th, 2010 at Naguga, DRC, 2 were killed and 1 escaped.",3.7176,28.5583,#2563A3
2/13/10,"LRA members abducted 3 civilians on February 13th, 2010 at Naguga, DRC. Later, 2 of the 3 were killed and 1 escaped.",3.7176,28.5583,#2563A3
6/23/09,"LRA forces ambushed a group security force members and civilians near Kiliwa, DRC on June 23rd, 2009. The LRA forces and security forces clashed, and there is no information on what happened to the civilians.",3.718,27.577,#2563A3
12/1/08,"LRA forces abducted a 16-year-old boy in Nagero, DRC, in December of 2008. The exact date of his abduction is unknown.",3.7186,29.5345,#2563A3
1/2/09,"This is part of the Christmas Massacres. LRA forces attacked Nagero, DRC, killing 10 people, injuring 6 people, and abducting at least 2 children.They also destroyed equipment at the park station and burned vehicles and the park station office.",3.7186,29.5345,#2563A3
5/7/10,"An LRA member was captured in Nagero, DRC. The details around the incident are unknown.",3.7186,29.5345,#2563A3
7/30/10,"LRA forces were spotted near the town of Nagero, DRC.",3.7186,29.5345,#2563A3
5/16/12,"After discovering 3 dead elephants near Nagero, DRC, park guards came across a group of 10 armed and suspected LRA combatants. The 10 suspected LRA retreated after 2 of them were injured. They abandoned their equipment and elephant tusks.",3.7186,29.5345,#2563A3
12/20/12,"2 Congolese adults and 2 Congolese children found their way to Nagero, DRC, after they were released by LRA forces near the Garamba river. They were abducted from Matahi, DRC, which is near Tomati.",3.7186,29.5345,#2563A3
4/27/13,"A Ugandan LRA man surrendered to security forces at a checkpoint at Nagero, DRC. According to the report, he was put on a bus and escorted to Gangala na Bodio.",3.7186,29.5345,#2563A3
7/31/13,"A 12-year-old girl escaped from LRA captivity while her captors were drunk and asleep and walked for 5 days before arriving in Nagero, DRC, where park rangers took her in. She was originally abducted from Aba, DRC, overnight between January 12 and 13.",3.7186,29.5345,#2563A3
11/4/08,"As reported on November 4th, 2008, LRA forces attacked Nagonyo, DRC, leading to a mass displacement of the population towards Dungu, DRC. This attack happened sometime before the major attack in Dungu on November 1st, 2008.",3.719,28.5897,#2563A3
6/9/09,"LRA forces attacked the village of Nagonyo, DRC. The result of this attack is unknown.",3.719,28.5897,#2563A3
8/12/09,"4 LRA combatants released 3 women and 1 baby on the same day that they were abducted from Nagonyo, DRC.",3.719,28.5897,#2563A3
8/12/09,"LRA forces attacked Nagonyo, DRC on August 12th, 2009. 3 women and 1 baby were abducted.",3.719,28.5897,#2563A3
1/16/10,"LRA forces attacked Nagonyo, DRC and killed 2 people.",3.719,28.5897,#2563A3
12/15/09,"3 LRA forces killed 1 person in the Zande Quarter, which is 3 km north of Niangara, DRC.  This attack took place on December 15, 2009.",3.7194,27.8872,#2563A3
1/27/11,"LRA forces looted 4 people traveling from Dungu, DRC to Ngilima, DRC.",3.72,28.589,#2563A3
5/5/11,"LRA members ambushed 3 cyclists traveling from Ariwara to Nagero, DRC, and looted their goods.",3.722,29.596,#2563A3
5/22/11,"1 of the 2 groups from the Lolo, DRC, attack headed back south. Group consisted of 8 Ugandan LRA and 8 abductees: 5 of which were adults from Lolo and the other 3 were children (2 boys & 1 girl) abducted from other villages. 4 of the adults were released.",3.723,26.048,#2563A3
3/20/11,"3 LRA members attacked Nawango, DRC, looting goods and abducting 2 adults and 1 child on March 20th, 2011. 1 of the adults was later able to escape.",3.7248,29.6624,#2563A3
5/4/13,An LRA man and an abducted 15-year-old girl stopped a civilian man traveling along the Dungu-Faradje road in the DRC. The LRA man said he wished to defect to security forces and freed the girl as a sign of his sincerity. The man & girl then left.,3.7269,29.5742,#2563A3
10/1/08,"During the month of October 2008, 5 girls were abducted by LRA forces  from Faradje, DRC, and its surroundings.",3.72723,29.70978,#2563A3
12/25/08,"A 28-year-old mother of five escaped LRA forces after being abducted in Faradje, DRC, earlier in the day with her husband and daughter. Her husband was killed by the LRA and her daughter is still with the LRA.",3.72723,29.70978,#2563A3
12/25/08,"LRA forces killed at least 16 children soon after they were abducted in Faradje, DRC. The majority of them were under 10 years of age.",3.72723,29.70978,#2563A3
12/25/08,"During the Christmas Masscres, LRA forces killed a total of at least 153 people in Faradje, DRC, and surrounding areas.",3.72723,29.70978,#2563A3
12/25/08,"This is part of the Christmas Massacres. 200 LRA attacked Faradje, DRC, killing at least 143 people, mostly men. LRA forces abducted 160 children and dozens of adults (est. 24), looted markets and homes, and burned 940 homes, 3 schools, and 9 churches.",3.72723,29.70978,#2563A3
3/22/09,"As reported for the week of March 22nd to 28th, 2009, suspected LRA forces looted villages of Tadu, Munya and Soruru, all of which are near Faradje, DRC.",3.72723,29.70978,#4B4B4B
4/28/09,"A girl who was possibly abducted during the Christmas Massacres in 2008 was able to escape from LRA captivity near Faradje, DRC, on April 25th, 2009. The exact location of where she escaped from is unknown, but she was in a compound with Joseph Kony.",3.72723,29.70978,#4B4B4B
5/17/09,"Suspected LRA forces clashed with security forces outside of Faradje, DRC on May 17th, 2009. The suspected LRA forces fled the clash.",3.72723,29.70978,#4B4B4B
5/23/09,"2 LRA members and their wives surrendered to security forces at Faradje, DRC on May 23rd, 2009.",3.72723,29.70978,#4B4B4B
7/1/09,"Security forces clashed with LRA forces near Faradje, DRC. 1 LRA member was captured in the attack.",3.72723,29.70978,#4B4B4B
7/4/09,"Security forces encountered members of the LRA and rescued 1 boy from captivity on July 4th, 2009. The exact location is unclear of this event is unclear.",3.72723,29.70978,#4B4B4B
9/3/09,"An LRA combatant arrived in Sadio, DRC, which is near Faradje and was captured by the local population before he was turned over to security forces.",3.72723,29.70978,#4B4B4B
9/26/09,"Security forces captured 3 LRA members on September 26th, 2009, at Faradje, DRC.",3.72723,29.70978,#4B4B4B
9/29/09,"On September 29th 2009, at Faradje, DRC, security forces captured 5 LRA members who had 4 female abductees with them.",3.72723,29.70978,#4B4B4B
10/28/09,"Security forces rescued 3 women from LRA captivity on October 28th, 2012, near Faradje, DRC.",3.72723,29.70978,#4B4B4B
11/3/09,"Lt. Col. Charles Arop surrendered to security forces on November 3rd, 2009. He was a senior commander and implicated in the Christmas Massacre. It is not clear where he surrendered, but possibly near Faradje, DRC.",3.72723,29.70978,#4B4B4B
11/9/09,"A total of 7 people came out of the bush, including 1 LRA combatant, 1 woman and her baby, and 4 young girls. They surrendered to security forces near Faradje, DRC on November 9th, 2009.",3.72723,29.70978,#4B4B4B
11/19/09,"On November 19, 2009, a group of 34 LRA surrendered to security forces in Faradje, DRC.",3.72723,29.70978,#4B4B4B
1/14/10,"On January 14th, 2010, security forces captured 1 suspected LRA woman in Faradje, DRC.",3.72723,29.70978,#4B4B4B
4/24/10,"A group of about 10 LRA were spotted near Faradje, DRC on April 24th, 2010.",3.72723,29.70978,#4B4B4B
2/11/11,"LRA forces attacked Faradje, DRC. As a result, the local population protested against a lack of protection from security forces.",3.72723,29.70978,#4B4B4B
5/19/11,"On May 19th, 4 of 5 abductees were released after being abducted by the LRA in Ngubu, DRC, near Faradje, -- the 5th abductee, a 12 year-old boy, was not released.",3.72723,29.70978,#4B4B4B
5/19/11,"The 2 women who were abducted from Ngubu, DRC, were tortured by the LRA. One had her arm broken.",3.72723,29.70978,#4B4B4B
5/19/11,"LRA members abducted 2 women and 3 children from fields near Ngubu, DRC, which is near Faradje, on May 19th, 2011.",3.72723,29.70978,#4B4B4B
7/5/11,"A young girl, abducted by suspected LRA earlier in the day, was able to escape near Faradje, DRC.",3.72723,29.70978,#4B4B4B
7/5/11,"A young girl was abducted by a group of suspected LRA near Faradje, DRC on July 5th.",3.72723,29.70978,#4B4B4B
12/19/11,"Civilians apprehended a suspected member of the LRA in a village near Faradje, DRC on December 19th, 2011.",3.72723,29.70978,#4B4B4B
1/8/12,"8 children abducted by the LRA on January 8th escaped shortly after the attack near Faradje, DRC.",3.72723,29.70978,#4B4B4B
4/2/13,"Suspected and armed LRA forces abducted 1 teenage boy 7 km east of Faradje, DRC, between Djabir and Takiani.",3.72723,29.70978,#4B4B4B
1/15/14,"Abducted in 2008 at age 15 by LRA forces, a woman came out of the bush with a baby  in Faradje, DRC. Her group was reportedly attacked by security forces while in South Sudan, who made her a 'wife'. She then escaped via Aba, DRC, before reaching Faradje.",3.72723,29.70978,#4B4B4B
7/10/10,"LRA members were sighted in various locations around Faradje, DRC and 2 abductees managed to escape into the town.",3.72723,29.70978,#4B4B4B
8/21/13,"An armed 25-year-old Ugandan LRA soldier defected to security forces 15 km west of Faradje, DRC, at 15:00. He spoke broken Lingala, had rasta-style hair and wore civilian clothing.",3.7274,29.5726,#4B4B4B
3/25/14,"The civilian youth from Wawe, near Niangara, DRC, went to look for the Congolese man abducted the day before. They found the man 2 km into  the bush, reportedly abandoned by LRA forces.",3.728339,27.903453,#4B4B4B
2/14/12,"6 suspected LRA looted 3 homes in Yanguma, DRC. They looted a variety of items including, but not limited to, goats, chickens, sponges, rice, and a radio. They told one of the victims that they only wanted to take food.",3.73,29.63,#4B4B4B
9/12/13,"Suspected LRA forces abducted a 45-year-old Congolese woman from her field near Yanguma, DRC. They forced her to carry heavy luggage. The assailants spoke Swahili and poor Lingala.",3.73,29.63,#4B4B4B
9/13/13,"A Congolese woman who was abducted near Yanguma, DRC, by suspected LRA forces the day before to carry goods was released the next day. After a day of walking, she returned to her community.",3.73,29.63,#4B4B4B
4/9/10,"A civilian was approached by an unclear number of LRA forces near Gangala Na Bodio, DRC and given a letter to deliver to the local authorities, after which some of his goods were stolen.",3.7305,29.5678,#4B4B4B
4/8/13,"On April 8, 2013, a suspected LRA camp was spotted in Garamba National Park in the DRC during a park ranger reconnaissance flight. A foot patrol was sent to the camp two days later where they found abandoned clothes, looted items, and cooking utensils.",3.730944,29.408256,#4B4B4B
