start_date,summary,latitude,longitude,marker_color
12/11/09,"3 LRA members injured 2 women in Bamokandi, DRC.",3.62037,28.5799,#2563A3
12/24/09,"LRA forces were reportedly seen near in Bamokandi, DRC on December 24th, 2009.",3.62037,28.5799,#2563A3
12/26/09,"2 suspected LRA members attacked villagers in Bamokandi, DRC.",3.62037,28.5799,#2563A3
1/6/10,"LRA forces were sighted near Bamokandi, DRC.",3.62037,28.5799,#2563A3
1/11/10,"LRA forces attacked Bamokandi, DRC, forcing it's citizens to flee. Security forces engaged the LRA and 3 civilians were wounded during the battle.",3.62037,28.5799,#2563A3
1/13/10,"In an attack on Bamokandi quarter in Dungu, DRC 8 well-armed LRA forces killed 5 civilians and wounded 2 more. Additionally, the LRA fighters engaged with regional security forces and were chased off.",3.62037,28.5799,#2563A3
1/14/10,"During a clash between security forces and LRA forces on January 14th, 2010 in Bamokandi, DRC, an LRA abductee who had been abducted 2 days earlier was able to escape. There are no other details surrounding the clash.",3.62037,28.5799,#2563A3
3/7/10,"2 LRA members surrendered to security forces at Bamokandi, DRC, on March 7th, 2010.",3.62037,28.5799,#2563A3
3/20/10,"LRA forces abducted 2 civilians and looted goods from Bamokandi, DRC, on March 20th, 2010.",3.62037,28.5799,#2563A3
3/21/10,"LRA forces abducted 1 young man at Bamokandi, DRC on March 21st, 2010.",3.62037,28.5799,#2563A3
3/4/11,"Security forces pursued and engaged 3 LRA who abducted 2 women on March 4th, 2011 in Bamokandi, DRC. In the firefight, 2 LRA members were killed and 1 abducted woman was injured.",3.62037,28.5799,#2563A3
3/4/11,"After a security force clashed with LRA forces near Bamokandi, DRC, 2 young women were able to escape, although 1 was severely wounded.",3.62037,28.5799,#2563A3
3/4/11,"3 LRA soldiers attempted to abduct 3 young women from Bamokandi, DRC, and were successful in abducting 2. Regional security forces pursued them.",3.62037,28.5799,#2563A3
3/21/11,"2 LRA attacked 1 man near Bamokandi, DRC as he was cutting bushes oustide of town on March 21st, 2011. The man was able to fight off the attackers successfully.",3.62037,28.5799,#2563A3
3/7/10,"LRA members released 1 woman near Bamokandi, DRC on March 7th, 2010.",3.6211,28.5814,#2563A3
3/8/12,"A group of 5 LRA, including 4 armed combatants and 1 unarmed woman, abducted 2 civilians and looted both food and non-food items from the community of Nanguakanza, DRC. Because of this attack, approximately 1,300 civilians were displaced.",3.62149,28.6537,#2563A3
3/9/12,"5 LRA members released 2 civilians, who had been abducted on March 8th. The LRA members then looted food from the home of a prominent community member in Nangbalama, DRC.",3.628,28.646,#2563A3
6/10/09,"LRA and security forces clashed at Kpodo, DRC. The results of this conflict are unknown.",3.628,29.713,#2563A3
2/13/11,"LRA combatants attacked the village of Kpodo, DRC resulting in the death of 1 adult.",3.628,29.713,#2563A3
6/19/11,"A group of suspected LRA forces abducted 2 civilians from Kpodo, DRC, on the night between June 19th and 20th, 2011.  Of the 2 victims, a 20-year-old boy was killed, and a 17-year-old girl remained in captivity for one night.",3.628,29.713,#2563A3
6/20/11,"Security forces rescued a 17 year-old girl abducted by suspected LRA forces from Kpodo, DRC. The security forces and LRA forces exchanged fire.",3.628,29.713,#2563A3
6/20/11,"Suspected LRA forces killed a 20 year old man, and abducted a 17 year old girl at Kpodo, DRC on June 20th, 2011.",3.628,29.713,#2563A3
6/20/11,"A 17-year-old girl, who had been abducted the day before by suspected LRA forces, was rescued by regional security forces on June 20, 2011, near Kpodo, DRC.",3.628,29.713,#2563A3
7/26/13,"Security forces captured an LRA member in Kpodo, DRC.",3.628,29.713,#2563A3
11/17/08,"As reported on November 17th, 2008, an unknown number of LRA forces were sighted in Mawese, which is 36 km away from Gangala na Bodio, DRC.",3.6281,29.1575,#2563A3
12/15/09,"This is the 10th incident in the Makombo Massacres. LRA forces met on a road outside of Kiliwa, DRC. According to Human Rights Watch, the abductees were forced to watch LRA commanders rape at least 7 girls, some as young as 11.",3.629,27.414,#2563A3
3/10/12,LRA forces clashed with security forces who were on patrol along the Dungu-Faradje road in the DRC. 2 LRA were killed and their rifles recovered.,3.62971,28.66329,#2563A3
6/1/09,"LRA forces killed 1 person at Amadi, DRC, during the month of June in 2009.",3.63,26.766,#2563A3
3/29/10,"LRA forces abducted 2 motorcyclists in Amadi, DRC.",3.63,26.766,#2563A3
8/11/11,"During the week of August 11th, a teenage girl escaped from LRA forces near Amadi, DRC, after 9 months in captivity.",3.63,26.766,#2563A3
2/23/12,"Security forces arrested an LRA element near the Uele River. He is reportedly of Ugandan nationality, and speaks a number of different languages. He is currently with security forces in Amadi, DRC.",3.6302,26.7789,#2563A3
8/2/08,"LRA forces were reportedly seen in Nyangwa Kawa, DRC between August 2nd and 8th, 2008.",3.6304,28.6567,#2563A3
3/13/13,"On March 13th, 2013, along the Dungu-Faradje road, a large group of suspected LRA forces including men, women and children, ambushed 3 civilians on motorcycles, looting bags of peanuts and their motorcycle batteries. The assailants then headed north.",3.6325,29.2813,#2563A3
3/3/09,"LRA forces abducted 6 civilians from communities near Dungu, DRC. The specific locations are unknown.",3.634,28.828,#2563A3
3/17/11,"On March 17th, 2011, LRA forces ambushed two traders near Wando, DRC, looting their goods. One man is still missing after the attacks, but it is not clear if he was abducted.",3.634,29.1666,#2563A3
2/21/11,"A group of 10 LRA attacked a vehicle carrying 3 passengers. As a result all the goods were looted, 1 passenger was killed, 1 injured, and 1 abducted. This attack happened southeast of Wando, DRC.",3.634,29.277,#2563A3
2/4/11,"LRA forces attacked a truck carrying civilians, killing a 9-year-old girl and injuring a 19-year-old man and 27-year-old woman. The attack took place east of Gangala na Bodio, DRC, on the Faradje-Dungu road.",3.6343,29.2827,#2563A3
3/28/13,"The 3 men who were abducted by 10 LRA forces the night before, were forced to help loot a truck as it was traveling along the Dungu-Faradje road, 18 km east of Gangala na Bodio, DRC. The looting took place at 16:30.",3.6344,29.2826,#2563A3
5/29/13,"Suspected LRA forces, led by a man with one eye, attacked a truck 18 km east of Gangala na Bodio, DRC. They looted various food and non-food items and abducted the driver and his assistant, aged 46 and 22, to carry the goods.",3.6361,29.2866,#2563A3
4/22/10,"A group of 5 LRA forces were spotted near Bagulupo, DRC.",3.637,29.022,#2563A3
6/6/11,"On June 6th, 2011, a group of about 30 suspected LRA attacked Bagulupo, DRC and looted about ten households.",3.637,29.022,#2563A3
6/8/11,"The LRA attacked and looted Bagulupo, DRC a second time in the same week on June 8th, 2011.",3.637,29.022,#2563A3
2/10/12,"5 LRA men looted food and medicine from a small health care center and abducted a man and his wife to act as carriers of the looted goods. This happened east of Dungu in Bagulupa, DRC.",3.637,29.022,#2563A3
2/10/12,"LRA  forces released a woman abducted from Bagulupa, DRC. She had been abducted to carry looted goods; her husband was not released as he had been killed while in captivity.",3.637,29.022,#2563A3
2/10/12,"LRA forces stabbed a man to death after he fell while carrying two sacks of flour and corn near the Dungu river at Bagulupa, DRC. Earlier in the day the man had been abducted with his wife.",3.637,29.022,#2563A3
2/17/12,"Around 20 heavily armed LRA forces attacked Bagulupa, DRC abducting 1 man and looting food items from the town. Among the LRA forces were 7 women and 3 children.",3.637,29.022,#2563A3
2/23/12,"2 civilians, abducted earlier in the evening from Bagulupa, DRC by the LRA, escaped unharmed.",3.637,29.022,#2563A3
2/23/12,"Overnight, roughly 40 LRA attacked Bagulupa, DRC. 3 people were abducted, and the LRA looted food and clothes from the community.",3.637,29.022,#2563A3
1/13/10,"After LRA forces attacked the village of Napusi, DRC on January 13th, 2010, security forces pursued and clashed with the LRA.",3.63892,28.58046,#2563A3
1/13/10,"LRA forces attacked Napusi, DRC killing 5 people and wounding 6.",3.63892,28.58046,#2563A3
1/9/11,"Security forces and suspected LRA clashed 90 km from Dungu, DRC along the Dungu-Faradje road in DRC.  1 civilian and 1 LRA were reportedly killed.",3.6395,29.288,#2563A3
6/13/13,"8 suspected and armed LRA forces, with women and children in town, looted a house and a shop at the Hangashabu locality near Manga Saba, DRC.",3.63999,29.37038,#2563A3
6/13/13,"9 suspected and armed LRA forces accompanied by children, stopped a vehicle near Manga Saba, DRC, which is along the road between Route 4 and Sambia, DRC. The driver and passengers fled while the assailants looted 12 cases of soft drinks before leaving.",3.63999,29.37038,#2563A3
2/15/11,"LRA forces killed 2 merchants on their motorbikes near the village of Sambia, DRC. The LRA proceeded to take anything of value off the corpses.",3.64,29.398,#2563A3
3/8/12,LRA forces abducted a man as they traveled along the Dungu-Faradje road in the DRC. He was used as a porter.,3.64027,28.76965,#2563A3
3/8/12,"At approximately 3:00 PM, security forces arrested a man who was suspected to be LRA along the Dungu-Faradje road in the DRC. The arrested person had rasta style hair.",3.6407,28.7627,#2563A3
11/17/10,"2 people were able to escape from LRA captivity after being abducted from the community of Pumuzika, DRC.",3.64072,29.41692,#2563A3
11/17/10,"LRA forces attacked Pumuzika, DRC, and killed 1 man by crushing his skull. 4 others were also abducted.",3.64072,29.41692,#2563A3
3/2/12,"A man and boy, abducted the day before along the Dungu-Faradje road in the DRC, were released by LRA forces. Their abductors left them with a note addressed to local security forces, explaining that the LRA will continue to attack to obtain food.",3.643,29.125,#2563A3
8/5/11,"An LRA combatant was captured by security forces near Dungu, DRC, on August 5th. Upon being questioned, he explained that he was sent to seek out a good place to loot supplies.",3.644,28.537,#2563A3
3/8/12,"LRA forces abducted 1 man and looted food from multiple houses along the Dungu-Faradje road in the DRC. This incident along with increased LRA activity in the area has caused the local population to flee, especially along the Dungu-Faradje road.",3.6443,28.7887,#2563A3
9/2/09,"A girl who was abducted earlier in the day by LRA forces in Zumass, which is near Dungu, DRC, managed to escape.",3.645,28.5531,#2563A3
9/2/09,"Approximately 6 LRA elements attacked the community of Zumass, which is 2 km from Dungu on the Ngilima road in the DRC . The assailants abducted 2 girls and shot an elderly man, who is believed to be in his 60s, in his left arm.",3.645,28.5531,#2563A3
3/9/12,"LRA forces released 2 men they had abducted the night before to use as porters. The men were released along the Dungu-Faradje road at the village of Navakasa, DRC. This location is an approximation.",3.6452,28.7795,#2563A3
3/6/12,"Around 3:00 PM, 4 presumed LRA combatants ambushed a civilian traveling on a motorcycle east of Dungu, DRC and unsuccessfully attempted to steal food from the rider as he had no food.",3.647,28.763,#2563A3
9/13/09,"Suspected LRA forces were sighted near Kilikili, DRC on Sept 13th and 14th, 2009.",3.6474,28.5737,#2563A3
1/23/10,"LRA forces wounded 1 civilian, abducted another, and looted Kilikili, DRC, during an attack on January 23rd, 2010.",3.6474,28.5737,#2563A3
7/22/13,"Approximately 33 suspected LRA forces attacked a truck and 2 motorcyclist about 95 km east of Dungu, DRC, along the Dungu-Faradje road. While the truck was being looted, security forces came across the incident and opened fire on the looters, who fled.",3.6475,29.3067,#2563A3
1/8/09,"This is part of the Christmas Massacres. 11 people were killed by LRA forces in Akua, DRC.",3.648,29.435,#2563A3
3/11/12,"LRA forces released 3 men who they abducted near Akua, DRC earlier in the day.",3.648,29.435,#2563A3
3/11/12,"Armed LRA forces abducted 1 man near Akua, DRC. This is the 3rd in a series of 3 abductions by this group on March 11th.",3.648,29.435,#2563A3
3/11/12,"A group of armed LRA abducted 1 man as he was traveling through Akua, DRC. This is the 1st in a series of 3 abductions by this group on March 11th.",3.648,29.435,#2563A3
3/11/12,"LRA forces abducted 1 man near Akua, DRC as he was traveling from Sambia, DRC. This is the 2nd in a series of 3 abductions by this group on March 11th.",3.648,29.4533,#2563A3
8/2/10,"4 LRA members kidnapped reportedly a 13-year-old boy south of Gaduma-Mala, DRC and stole his crops.",3.6481,29.7087,#2563A3
1/9/11,6 LRA clashed with security forces at a crossroads along the Dungu-Faradje road in the DRC. This is also a military checkpoint. 1 civilian died in the crossfire.,3.6489,29.3153,#2563A3
1/11/11,3 civilians transporting goods were attacked by LRA combatants at a crossroads along the Dungu to Faradje road in the DRC. The LRA took the goods left behind as the civilians fled.,3.6489,29.3153,#2563A3
4/25/11,"A group of 9 suspected LRA combatants attacked a supply convoy guarded by security forces 90km east of Dungu, DRC along the Dungu-Faradje Road. After taking fire, the security forces fired warning shots and the combatants fled into the forest.",3.6489,29.3153,#2563A3
4/26/11,"5 suspected LRA blocked 2 vehicles at a crossroads on the Dungu-Faradje road in the DRC, and started firing at the convoy. The security forces returned fire, scattering the combatants into the bush.",3.6489,29.3153,#2563A3
2/4/11,"LRA combatants ambushed a vehicle near the community of Nangume, DRC. 1 woman & 2 young children were seriously wounded and a 12 year old girl was brutally killed. LRA looted the vehicle and were reportedly heard speaking Acholi.",3.64997,29.30414,#2563A3
5/3/11,"LRA members ambushed 5 civilians on May 3rd, 2011, at Nangume, DRC. The LRA members looted goods and abducted 1 civilian to carry the goods.",3.64997,29.30414,#2563A3
3/16/11,"LRA forces attacked traders on the road between Dungu and Faradje, DRC and looted their goods. The LRA forces were scared off when security force trucks happened upon the scene.",3.65,29.31,#2563A3
3/6/12,"4 LRA combatants abducted 1 hunter during a clash with local security forces about 26km east of  Dungu, DRC.",3.653,28.783,#2563A3
10/1/09,"On October 1st, 2009, LRA forces killed 1 civilian in Dingila, DRC.",3.6532,26.0585,#2563A3
5/1/11,"Over the course of May 2011, suspected LRA forces abducted 5 civilians during attacks on Lukutu, Nganga and Tubu, all located roughly 10 km away from Dingila, DRC.",3.6532,26.0585,#2563A3
5/19/11,"On May 19th, LRA forces released 9 adults to Tubu, DRC near Dingila after being abducted the night before. The 13 children who were also abducted were not released.",3.6532,26.0585,#2563A3
6/15/10,"LRA were spotted near the village of Nakale, DRC on June 15th, 2010.",3.65348,28.57338,#2563A3
6/16/10,"2 people abducted by LRA combatants from Kpaika were rescued by the FARDC near Nakale, DRC on June 16th, 2010.",3.65348,28.57338,#2563A3
6/25/10,"A man escaped from the LRA near Nakale, DRC, after having been abducted 2 weeks before. He had been abducted with 2 family members, 1 was killed in captivity and 1 was still with the LRA at the time of the victim's escape.",3.65348,28.57338,#2563A3
11/7/10,"The 22-year-old woman abducted by LRA combatants from Nangwende, DRC, in January escaped and was found by security forces a few days later at Nakale, near Dungu. She was abducted with 5 others (mostly family members), but was the only one who survived.",3.65348,28.57338,#2563A3
3/17/12,"LRA forces encountered a hunter near Nakale, DRC,  and gave him a letter addressed to security forces, expressing their desire to surrender.",3.65348,28.57338,#2563A3
3/1/12,"4 LRA forces abducted a man and boy aged 17 and 22, and looted their food. The combatants were reportedly wearing both camouflage and civilian clothing, and were speaking broken Lingala. This happened along the Dungu-Faradje road in DRC.",3.656,29.07,#2563A3
5/22/11,"A group of suspected LRA forces attacked an unknown location along the Dungu-Faradje road in DRC on May 22, 2011.  The attackers looted food from one home, kidnapped a 15-year-old girl, and shot and wounded the owner of the looted home.",3.6561,29.0573,#2563A3
2/15/10,"1 of the 2 civilians abducted by LRA members on February 10th, 2010 was able to escape near Niangara, DRC, on February 15th, 2010.",3.657,27.818,#2563A3
1/26/10,"A small group of LRA attacked security forces in Lanzi, DRC on the morning of January 26th, 2010.",3.6582,28.5641,#2563A3
6/16/10,"Security forces and LRA forces clashed in Lanzi, DRC. There are no details surrounding the event or the location.",3.6582,28.5641,#2563A3
5/21/13,3 suspected LRA forces carrying lots of luggage were spotted crossing the Dungu-Faradje road heading south in the DRC. They were spotted by a group of park rangers and civilians who were traveling along the road.,3.6584,29.0125,#2563A3
12/26/09,A small number of LRA forces were spotted north of the town of Dungu along the main road between Dungu and Ngilima in the DRC. They fled after seeing security forces.,3.659,28.55,#2563A3
8/14/08,"On August 14th, 2008, 4 LRA forces reportedly defected near Kiliwa, DRC.",3.66,27.543,#2563A3
8/15/08,"As reported on August 15th, 2008, an LRA camp of roughly 300 LRA forces was sighted by a civilian east of Kiliwa, DRC.",3.66,27.543,#2563A3
12/16/09,"This is the 11th incident in the Makombo Massacres. On the way to Kiliwa, DRC, they killed at least 5 abductees and killed many more in Kiliwa. They camped in the town overnight. Approximately 25 people were killed in total.",3.66,27.543,#2563A3
12/27/09,"LRA forces and security forces clashed at Nangwende, DRC.",3.66307,28.46764,#2563A3
1/2/10,"LRA members were spotted on January 2, 2010 in Nangwende, DRC, between Ngilima and Dungu.",3.66307,28.46764,#2563A3
1/3/10,"LRA forces attacked Nangwende, DRC, looting the village and burning down homes.",3.66307,28.46764,#2563A3
4/6/10,"Suspected LRA forces fired at security forces in Nangwende, DRC on April 6th, 2010.",3.66307,28.46764,#2563A3
4/20/10,"As reported on April 20th, LRA forces were spotted near Nangwende, DRC.",3.66307,28.46764,#2563A3
1/4/10,"Security forces arrested an suspected LRA member in Ondolea, DRC.",3.664,29.342,#2563A3
1/23/10,"LRA forces attacked Nanvii, DRC, and abducted 1 person.",3.6644,28.5715,#2563A3
11/4/09,"Suspected LRA forces abducted 2 boys near Bamokandi, DRC, on November 4th, 2009.",3.666,28.549,#2563A3
5/12/09,"LRA forces attacked a community near Dungu, DRC on May 12th, 2009. Security forces quickly responded, killing 1 LRA member. LRA forces killed 1 female and injured 1 male during the incident.",3.6672,28.5402,#2563A3
1/25/11,"LRA forces abducted a park ranger's 2 daughters and looted his house at the edge of Garamba National Park near Gangala na Bodio, DRC.",3.669,29.164,#2563A3
12/5/10,"LRA forces abducted an 8-year-old boy from Dungu, DRC, after looting several homes and attempting to abduct other children.",3.6704,28.5914,#2563A3
12/14/09,This is the 1st incident in the Dec 2009 Makombo Massacres.  25-40 LRA crossed the Uele river in DRC and approached an elderly woman and  looted her home. They abducted and killed an unknown number of locals.,3.671,27.467,#2563A3
12/14/09,"This is the 2nd incident in the Makombo Massacres. Upon arriving in Mabanga Ya Talo on December 14th, 2009, the LRA began to kill and abduct local civilians. At least 40 people were abducted and an unknown number were killed.",3.671,27.467,#2563A3
12/15/09,"An elderly man who had been abducted the day before during the Makombo Massacres in DRC was released near the Uele River on December 15th, 2009.",3.6731,27.4885,#2563A3
8/2/08,"LRA forces reportedly looted Nangbe, DRC between August 2nd and 8th, 2008.",3.67624,28.52735,#2563A3
1/5/10,"18 LRA forces clashed with security forces on the Dungu-Faradje road near Nagero, DRC.",3.6775,29.3519,#2563A3
8/18/09,"LRA forces attacked 2 men roughly 5 km outside of Nangbende, DRC. 1 of the men was killed during the attack.",3.6794,28.481,#2563A3
1/13/10,"LRA combatants abducted 2 men from Nangbende, DRC, and looted goods on January 13th, 2010.",3.6794,28.481,#2563A3
1/3/10,"Security forces arrested a suspected LRA member in Gangala na Bodio, DRC.",3.6797,29.1357,#2563A3
6/21/10,"2 LRA forces were captured by security forces in Gangala na Bodio, DRC.",3.6797,29.1357,#2563A3
1/9/11,"Suspected LRA forces ambushed 6 local traders and abducted 1 of the traders near Gangala na Bodio, DRC.",3.6797,29.1357,#2563A3
1/9/11,"LRA forces attacked and killed a security force member and a farmer near Gangala na Bodio, DRC.",3.6797,29.1357,#2563A3
1/14/11,"9 people transporting goods by motorcycles were attacked by suspected LRA combatants near Gangala na Bodio, DRC. The goods and 1 motorcycle were looted, and the remaining 8 were damaged.",3.6797,29.1357,#2563A3
1/24/11,"LRA forces attacked Gangala na Bodio, DRC killing 2 civilians.",3.6797,29.1357,#2563A3
1/25/11,"Suspected LRA forces killed 2 men in Gangala na Bodio, DRC.",3.6797,29.1357,#2563A3
5/22/11,"1 was killed and 1 abducted when LRA forces attacked Gangala na Bodio, DRC.",3.6797,29.1357,#2563A3
6/4/11,"Suspected LRA forces killed a man near a spring in Gangala na Bodio, DRC, on June 4th, 2011.",3.6797,29.1357,#2563A3
6/13/11,"LRA fighters ambushed 2 men transporting fuel by motorbike at Gangala na Bodio, DRC on June 13th, 2011. 1 man was abducted, and the other managed to escape. The LRA then emptied the fuel cans before stealing them.",3.6797,29.1357,#2563A3
8/24/11,"LRA forces killed a 26-year-old pregnant woman, her 1-year-old daughter, and another member of the community in Gangala na Bodio, DRC.",3.6797,29.1357,#2563A3
3/28/13,Armed and suspected LRA forces ambushed 3 men who were traveling and looted their goods before abducting 2 of the men. The third man managed to escape. This attack took place a few kilometers outside of Gangala na Bodio.,3.6797,29.1357,#2563A3
5/29/13,"A driver and an assistant, who were abducted earlier in the day by LRA forces to carry goods, were released and returned to Gangala na Bodio, DRC.",3.6797,29.1357,#2563A3
8/1/10,"LRA members looted houses in the village of Gaduma-Mala, DRC.",3.68003,29.7181,#2563A3
8/3/10,"The 13-year-old boy who had been abducted by the LRA near Gaduma-Mala, DRC on August 2, 2010, was released the next day.",3.68003,29.7181,#2563A3
11/4/08,"As reported on November 4th, 2008, LRA forces attacked Kakalika, DRC, leading to a mass displacement of the population towards Dungu, DRC. This attack happened sometime before the major attack in Dungu on November 1st, 2008.",3.6801,28.6117,#2563A3
1/15/10,"LRA members killed 2 civilians in Kakalika, DRC on January 15th, 2010.",3.6801,28.6117,#2563A3
5/10/10,"LRA forces killed 2 civilians and injured 1 child at Kakalika, DRC on May 10th, 2010.",3.6801,28.6117,#2563A3
9/19/10,"LRA members attacked and looted villagers outside of Niangara, DRC.",3.6825,27.8883,#2563A3
5/1/10,"As reported on May 1st, 2010, security forces captured 2 young LRA members around Niangara, DRC.",3.6839,27.878,#2563A3
10/1/09,"LRA members killed 1 civilian and abducted 8 others at Zengbe, DRC, on October 1st, 2009.",3.684,27.228,#2563A3
3/22/12,"2 young boys spotted 2 LRA forces, a man and woman, near Nakale, DRC. The boys fled, but it was later discovered that the 2 LRA members wished to surrender.",3.684,28.57,#2563A3
2/6/11,"A group of 10 LRA attacked a transport,  looting food along the Faradje-Dungu road in the DRC. One nurse was abducted and food and money were taken from the passengers.",3.685,29.42,#2563A3
3/31/10,"LRA forces released 1 woman near Kaka, DRC on March 31st, 2010. The woman had been abducted about 10 days before her release.",3.6851,28.4168,#2563A3
3/17/13,"On March 17th, 2013, 2 men on motorcycles traveling from Kurukwata towards Dungu, DRC, were looted by at least 15 LRA forces, including women and 4 armed men. The assailants told the victims that they do not want to hurt anyone but they needed food.",3.686,29.4163,#2563A3
7/27/13,"Garamba Park Rangers encountered an LRA group while they were on patrol between Gangala na Bodio and Nagero, DRC. After an exchange of fire, an 18-year-old Congolese man was able to escape from captivity and was taken back to the GNP station.",3.6861,29.4163,#2563A3
3/9/12,LRA forces released a woman after she was abducted earlier in the day along the Dungu to Faradje Road in the DRC. The exact location of her release remains unclear.,3.68614,29.41559,#2563A3
3/9/12,"LRA members shot and injured 2 men traveling in a private vehicle along the Dungu to Faradje Road in the DRC. The combatants also abducted 1 woman after she fell out during the attack, and looted her money and clothing.",3.68614,29.41559,#2563A3
2/25/13,"In the morning of February 25th, 2013, 2 cyclists going from Aba, DRC, to Sambia, DRC, were ambushed by 6 suspected LRA forces. Both victims were looted of their goods but then managed to escape.",3.6865,29.415,#2563A3
12/14/09,"The 3rd incident in the Makombo Massacres. On the road between Mabanga Ya Talo and Makombo, 22 bodies were buried, at least 40 other bodies were reported. 10 of the men killed had been tied to trees and hit with machetes. 1 man survived with injuries.",3.687,27.381,#2563A3
