start_date,summary,latitude,longitude,marker_color
7/1/08,"As reported on July 1st, 2008, a Ugandan LRA fighter who had been in the bush for 11 years defected in Bunia, DRC, 12 days after escaping from Bitima, DRC.",1.5724,30.2493,#2563A3
3/29/09,"As reported on April 4th, 2 LRA escapees - 1 Sudanese and 1 CAR national - were brought to Bunia by security forces during the previous week.",1.5724,30.2493,#2563A3
11/1/09,"2 foreign NGO workers were abducted by LRA forces from Birao, CAR, during the month of November in 2009.",10.29343,22.78245,#2563A3
10/10/10,"LRA forces attacked the town of Birao, CAR, abducting 23 people, including 5 children, and looted the main market.",10.29343,22.78245,#2563A3
10/11/10,"Over the week of October 11th to October 17th, another rebel group pursued the LRA forces who had recently attacked Birao, CAR. 21 of the 23 people originally abducted were able to escape, including 5 abducted children.",10.29343,22.78245,#2563A3
3/14/10,"2 foreign NGO workers who were abducted by LRA forces from Birao, CAR, during the month of November in 2009 were released on March 14, 2010, in an unknown location in Darfur, Sudan.",11.3,24.18,#2563A3
9/23/08,"Between September 23rd-25th, 2008, an estimated 200 LRA forces with women & children were sighted crossing Aungba, DRC, entering the nearby forest, where they spent one week, before moving north to Kerekere, DRC. The GPS coordinates are a rough estimate.",2.5426,30.5287,#2563A3
12/23/95,"LRA abducted a 12-year-old boy from Omel in Gulu District, Uganda, while he was walking home from fishing.",2.883,32.583,#2563A3
8/7/09,"Seucirty forces engaged the LRA on August 7th, 2009 in Vonga, DRC.",2.9016,27.5173,#2563A3
8/7/09,"LRA forces attacked part of Vonga, DRC, on August 7th, 2009. 2 women were abducted and 1 child was found abandoned.",2.9016,27.5173,#2563A3
4/3/10,"An LRA group was sighted near Ariwara Moke, DRC.",2.9856,29.3307,#2563A3
9/17/09,"A van travelling near Watsa, DRC was looted by suspected LRA on September 17th, 2009. It is unclear what goods were taken. No casualties were reported.",3.009,29.433,#2563A3
9/12/09,"1 child escaped LRA captivity and reported to security forces near Watsa, DRC.",3.02876,29.52541,#2563A3
3/28/10,"2 LRA abducted abducted 2 fishermen and stole 2 canoes at the community of Ligbombi, DRC, on March 28th, 2010.",3.0438,29.4317,#2563A3
1/16/09,"This is part of the Christmas Massacres. LRA forces attacked Tora, DRC, killing as many as 100 people.",3.05,29.533,#2563A3
9/20/09,"LRA forces attacked Durba, DRC, on September 20th, 2009. 20 people were abducted and a number of houses were looted. This was a part of a string of attacks additionally through Galaylu, Lindi, Lukulu and Sururu but there are no further details.",3.10238,29.58241,#2563A3
7/20/10,"Security forces, escorting civilians near Durba, DRC, were attacked by LRA forces.",3.10238,29.58241,#2563A3
9/30/09,"On September 30, 2009 at Ariwara, DRC, a young boy returned who had escaped from LRA captivity. He had been abducted a couple months earlier.",3.1359,30.6999,#2563A3
6/19/09,"Security forces clashed with members of the LRA at Poko, DRC on June 19th, 2009. It was reported that 2 LRA members were killed and 15 civilians were rescued from captivity.",3.1381,26.8942,#2563A3
7/3/10,"Security forces captured 1 Ugandan LRA member near the community of Gatanga, DRC.",3.15676,29.63463,#2563A3
7/25/11,"LRA forces abducted a 17-year-old girl from Doko, DRC.",3.19509,29.59155,#2563A3
2/1/10,"The LRA went on a killing spree through Munuku, DRC, and the surrounding communities between February 1 to 13, 2010.  At least 74 civilians were killed and 75 abducted.  Of those killed, at least 14 were children and 15 were elderly.",3.251,27.894,#2563A3
7/20/94,"LRA forces abducted 1 boy from Panyoro, Uganda, on the afternoon of July 7, 1994. A few hours later, the same group abducted another boy a few kilometers away from Panyoro.",3.274,31.719,#2563A3
4/19/10,"Security forces arrested 2 LRA elements in Lwabi, DRC on April 19th, 2010.",3.329,29.6384,#2563A3
1/22/12,"Suspected LRA attacked and looted Mangwa, DRC. The combatants reportedly abducted 6 children and injured a woman.",3.3666667,28.4833333,#2563A3
12/14/12,"6 suspected and armed LRA men attacked Sirigi, DRC, and abducted 4 Congolese men and a 12-year-old child. The assailants also looted, cassava flour, paddy, beer, clothes, and other goods. Civilians fled toward Tomati, DRC.",3.3753,29.5506,#2563A3
2/9/13,"On February 9th, 2013, suspected LRA forces ambushed 3 men on bikes in the area of Sirigi, DRC, and looted their possessions.",3.3753,29.5506,#2563A3
2/11/13,"On February 11th, 2013, 4 men and 3 women suspected LRA forces looted food and non-food items in Sirigi, DRC.",3.3753,29.5506,#2563A3
2/16/13,"On February 16th, 2013, suspected LRA forces looted a civilian on a bike around Sirigi, DRC.",3.3753,29.5506,#2563A3
12/15/09,"LRA forces killed 10 civilians at Nakiliwa, DRC on December 15th, 2009. The incident was reported as a significant distance west of the Makombo Massacres, however there are still questions surrounding the incident.",3.3877,27.2863,#2563A3
3/17/12,"Armed LRA forces killed 1 man and abducted 2 boys and 1 girl from the Garantie quarter near Tomati, DRC. The combatants also looted 9 houses in the attack.",3.3924,29.5956,#2563A3
1/10/09,"This is part of the Christmas Massacres. LRA forces attacked Tomati, DRC between January 10 and 11th, 2009, killing 30 people.",3.3956,29.5857,#2563A3
4/12/10,"On April 12th, 2010, LRA forces attempted to attack Tomati, DRC but security forces fought them off and recovered 1 abducted child.",3.3956,29.5857,#2563A3
3/15/12,"LRA forces abducted 2 children near Tomati, DRC.",3.3956,29.5857,#2563A3
3/18/12,"2 men escaped from LRA captivity during a clash with security forces near Tomati, DRC.",3.3956,29.5857,#2563A3
3/18/12,"2 children, abducted by LRA forces on March 15th, escaped from captivity near Tomati, DRC.",3.3956,29.5857,#2563A3
12/14/12,"2 Congolese adults and 2 Congolese children were abducted by 5 suspected LRA men who were armed. The abduction took place in Matahi, DRC, which is near Tomati. The assailants also looted various household items and peanuts.",3.3956,29.5857,#2563A3
1/22/13,"The 2 men abducted by 7 LRA forces in Tomati, DRC, were released in an unknown location later that night.",3.3956,29.5857,#2563A3
1/22/13,"7 armed LRA men abducted 2 women and 2 men from their home in Tomati, DRC. This group later also looted a household.",3.3956,29.5857,#2563A3
1/23/13,"The 2 women abducted by 7 LRA forces on January 22nd, 2013, were released in an unknown location the next morning.",3.3956,29.5857,#2563A3
6/20/09,"Security forces clashed with LRA forces near Awago and Kareo, DRC on June 20th, 2009. Between the two clashes, 3 LRA members were killed, 6 others were captured, and 12 civilians were rescued from LRA captivity.",3.3978,29.6578,#2563A3
7/17/13,"At approximately 11:00 PM, 6 LRA forces, including a woman, abducted a 60-year-old man, 14-year-old girl and a 22-year-old woman from an area 2 km east of Sambia, DRC. Unspecified goods were also looted.",3.3998,29.2883,#2563A3
1/8/09,"During the Christmas Massacres, LRA forces killed a total of 256 people in attacks on villages south and west of Faradje, DRC, including Sambia, Akua, Tomate, and Tora.",3.4,29.27,#2563A3
1/8/09,"This is part of the Christmas Massacres, and the first attack on Sambia, DRC. In this attack, LRA forces killed 9 people were killed.",3.4,29.27,#2563A3
1/10/09,"This is part of the Christmas Massacres, and the second attack on Sambia, DRC. LRA forces killed 36 people in Sambia between January 10th and 11th, 2009.",3.4,29.27,#2563A3
6/18/09,"Security forces clashed with LRA forces on June 18th, 2009 near Sambia, DRC. During the clash, 2 abducted persons were rescued.",3.4,29.27,#2563A3
2/27/10,"LRA forces abducted a young girl from Sambia, DRC on February 27th, 2010.",3.4,29.27,#2563A3
3/3/10,"A girl who was abducted from Sambia, DRC, by LRA forces on February 27th, 2010, was able to escape.",3.4,29.27,#2563A3
4/3/10,"9 LRA forces attacked Sambia, DRC, on April 3rd, 2010. Security forces responded. 1 civilian died, 1 abductee was released, and 1 LRA member was killed.",3.4,29.27,#2563A3
4/4/10,"12 people who had been abducted from Sambia, DRC, earlier that day by suspected LRA forces, were rescued by security forces. The date and location of this incident are an approximation.",3.4,29.27,#2563A3
4/4/10,"An estimated 19 LRA members attacked Sambia, DRC, killing 1 civilian, abducting 12 people, and looting homes for several hours. 1 LRA combatant was reported dead.",3.4,29.27,#2563A3
4/6/10,"LRA combatants attacked Sambia, DRC, but were rebuffed by security forces. The result of this attack is unknown.",3.4,29.27,#2563A3
4/7/10,"After the attacks in Sambia, DRC, on April 4th, 2010, security forces pursued the LRA combatants, recovering 12 people who had been abducted. 1 civilian died in the clash.",3.4,29.27,#2563A3
4/11/10,"Security forces and LRA members clashed near Sambia, DRC resulting in the death of 4 LRA.",3.4,29.27,#2563A3
6/18/10,"The presence of LRA forces were reported in Sambia, DRC, on June 18th and 19th, 2010. There were no reports of the activities of this LRA group.",3.4,29.27,#2563A3
6/17/13,"20 suspected LRA forces attacked and looted Sambia, DRC. They fired shots into the and looted unspecified food and non-food items. Security forces returned fire and the assailants fled east. Security forces pursued  them.",3.4,29.27,#2563A3
12/15/09,"50,000 people have fled the Dingba, DRC area as a result of the Makombo Massacre that happened from December 13-14, 2009. Most headed south toward Isiro or Rungu, DRC",3.4079,27.9242,#2563A3
12/19/09,"On December 19th, 2009, a boy was arrested and accused of being an LRA spy by security forces in Dingba, DRC. He turned out to be a former abductee of the LRA.",3.4079,27.9242,#2563A3
6/12/12,"Because of an intervention by security forces, a girl was released from LRA captivity after being abducted in Bangabila, DRC.",3.411667,28.776944,#2563A3
6/12/12,"LRA forces abducted 1 girl in Bangabila, DRC.",3.411667,28.776944,#2563A3
4/11/12,"Suspected LRA released a woman after she was abducted with her husband earlier in the day near Sambia, DRC.",3.4132,29.2829,#2563A3
4/11/12,"A group of suspected LRA abducted a man and his wife 2 kilometers northeast of Sambia, DRC.",3.4132,29.2829,#2563A3
3/21/08,"LRA forces were reported to be in Kitambala, DRC.",3.42719 / 30.33418,,#2563A3
1/7/08,"Around January 7th, 2008, a LRA force defected to security forces somwhere around Palabek, Uganda.",3.4404,32.5846,#2563A3
6/4/09,"2 LRA members surrendered to security forces near Nabanga, DRC, which is near Tapili, DRC.",3.4476,27.6375,#2563A3
12/14/09,"During the Makombo Massacres of December 2009, the LRA killed over 321 people and abducted 250, including at least 80 children.",3.4476,27.6375,#2563A3
12/15/09,"This is the 9th incident in the Makombo Massacres. LRA forces abducted an estimated 185-200 people and looted shops during an attack on Tapili, DRC.",3.4476,27.6375,#2563A3
1/1/10,"7 abductees from the Makombo Massacres, mostly teenagers, attempted to escape. 5 were killed (3M, 2F) and 2 boys made it to safety. As of the day of escape, the LRA had 186 abductees with them. One boy was from Tapili, the escape location is unknown.",3.4476,27.6375,#2563A3
1/16/13,"Suspected LRA forces abducted a man and a woman near Tapili, DRC, between January 16th and 17th.",3.4476,27.6375,#2563A3
1/18/13,"Suspected LRA forces released a man and a woman near Tapili, DRC, 2 days after their abduction. They were released with a letter warning that the LRA would attack the nearby town of Niangara within a few days.",3.4476,27.6375,#2563A3
2/8/12,"Suspected LRA combatants released 4 civilians at Yamba Yamba, DRC on February 8th after they were abducted in Tadu earlier in the day.",3.4505,29.4331,#2563A3
12/15/09,"This is the 8th incident in the Makombo Massacres. A local official & a security force officer left Tapili and traveled towards Ngiribi to investigate the rumors of an LRA attack. The LRA attacked them, gouged out their eyes, and killed them both.",3.456,27.6,#2563A3
7/10/09,"LRA forces attempted to attack civilians in Tadu, DRC on July 10th, 2009. Security forces responded and chased the LRA forces away. 2 LRA members were killed. The LRA forces also looted goods from civilians in the area.",3.4653,29.7024,#2563A3
7/13/09,"Suspected LRA forces tried to attack civilians at Tadu, DRC on July 13th, 2009. Security forces responded and clashed with the LRA. 4 LRA members were killed and 1 was captured.",3.4653,29.7024,#2563A3
12/29/09,"A man who had been abducted by the LRA five days earlier on Dec. 24 was found dead in the village of Ngorovani, DRC which is near Tadu, DRC. This report is being mapped at Tadu, as the coordinates for Ngorovani are not yet known.",3.4653,29.7024,#2563A3
4/13/10,"Security forces arrested a 13-year-old boy for spying for the LRA in Ngorovani, DRC which is 13 kilometers from Tadu, DRC.",3.4653,29.7024,#2563A3
4/13/10,"LRA forces clashed with security forces at Tadu, near Faradje, DRC.",3.4653,29.7024,#2563A3
2/13/11,"2 LRA members attempted to abduct 2 girls collecting water near Tadu, DRC.",3.4653,29.7024,#2563A3
2/8/12,"Suspected LRA combatants abducted 4 civilians on the evening of February 8th, in Tadu, DRC.",3.4653,29.7024,#2563A3
9/8/09,"Security forces attacked the LRA, and as a result 1 abducted woman and 2 children were rescued on September 8th, 2009, near Zamai, DRC.",3.476,26.765,#2563A3
12/15/09,"This is the 7th incident in Makombo Massacres. Ngiribi's population attempted to flee, but many were captured. More than 20 men were killed. One source reported that almost the entire town was captured.",3.48,27.561,#2563A3
1/13/11,"LRA forces robbed 10 merchants from Ariwara in Gangu, DRC. The LRA combatants took all their merchandise, their motorcycle batteries, and left a letter behind for the security forces in the area.",3.48119,29.3177,#2563A3
6/9/09,"Security forces clashed with LRA combatants at the village of Karisia, DRC on June 9th, 2009. 2 children were able to escape from the LRA during the fight.",3.482,29.724,#2563A3
3/11/11,"LRA forces abducted 3 civilians in Gagombe, DRC.",3.49,29.64,#2563A3
1/26/13,"On January 26th, 2013, 2 LRA men and 2 LRA women looted food and non-food items in Kaligba, DRC.",3.492,29.72,#2563A3
1/27/13,"On January 27th, 2013, the same group that had looted Kaligba, DRC, the previous day attacked the same location again and abducted 3 civilians.",3.492,29.72,#2563A3
3/20/13,"15 suspected LRA ambushed 3 men 11 km north of Sambia, DRC. They opened fire on the men as they fled, hitting 1 man in the foot. A small number of security forces arrived, but did not pursue the assailants. Unspecified goods were looted.",3.499,29.2642,#2563A3
12/14/09,This is the 6th incident in the Makombo Massacres. At least 6 people were killed and 1 person raped at this location but there were many more. LRA forces camped in Mangada for the night.,3.5138,27.4765,#2563A3
3/13/10,"As reported on March 13th, 2010, LRA forces were known to be present in the Niangara, DRC area.",3.5138,27.4765,#2563A3
4/13/10,"A woman was attacked by 4 LRA elements in Niangara, DRC. After clasping her lips together with pliers, the LRA combatants forced a 16-year-old Congolese boy, abducted during a previous attack, to slice off her lips and her right ear with a knife.",3.5138,27.4765,#2563A3
4/24/10,"On April 24th, 2010, near Niangara, DRC, 1 young boy was able to escape from LRA captivity.",3.5138,27.4765,#2563A3
5/27/11,"On May 27th, a 15 year-old girl was able to escape from LRA captivity after having been abducted in 2009. She had married a chief of the group in the bush. She is now in Niangara, DRC - over 105 km from Ngilima where she was originally abducted.",3.5138,27.4765,#2563A3
6/16/11,"During the week of June 16th, 2011 it was reported that three suspected LRA forces had been sighted around Niangara, DRC.",3.5138,27.4765,#2563A3
11/21/13,"On November 21, 2013, 6 suspected LRA forces, 2 of which were armed, delivered a message to a woman in Mangada, DRC, staying that they planned to attack the community to avenge their ""friend.""",3.5138,27.4765,#2563A3
10/21/10,"7 LRA members were seen in Gangala Bazekpete, DRC on October 21, 2010. The location of Gangala Bazekpete is a rough estimate.",3.5146,28.2319,#2563A3
6/7/11,"1 suspected LRA member was captured by civilians on the road from Poko to Dingila, DRC on June 7th, 2011. The other members of the suspected LRA member's group were able to flee.",3.521,26.386,#2563A3
11/4/08,"On November 4th, 2008, LRA forces looted the goods of merchants 18 km away from Dungu, DRC.",3.524,28.696,#2563A3
7/11/10,"A woman was severely beaten after resisting an attempted rape by reported LRA elements south of Gaduma-Mala, DRC. She died while in transport to emergency medical services.",3.52644,29.74051,#2563A3
3/15/10,"5 LRA forces robbed a group of civilians traveling along the road from Gangu to Faradje, DRC.",3.5477,29.4602,#2563A3
1/11/10,"Suspected LRA forces attacked civilians near Salawa, DRC, causing the population to flee the area.",3.55186,28.36923,#2563A3
5/21/11,"On May 21st, a woman was killed on her way back from a market in Denge, DRC. Her body was found with several stab wounds on May 23rd.",3.552,28.242,#2563A3
9/16/09,"LRA forces attacked Sabuni, DRC on September 16th, 2009. In the attack, 2 LRA forces were killed and 1 was captured by security forces.",3.5524,29.90071,#2563A3
12/12/09,"LRA forces attacked Sabuni, DRC, abducting 3 adults and looting goods.",3.5524,29.90071,#2563A3
12/14/09,"This is the 5th incident in the Makombo Massacres. The LRA killed many of the people they had abducted. According to those who buried the dead & Human Rights Watch, this was the highest concentration of deaths. 30 people killed is an estimate.",3.56,27.477,#2563A3
1/28/10,"LRA members abducted 4 civilians on January 28th, 2010 in Mburu, DRC.",3.568,27.008,#2563A3
5/1/11,"A combined total of 22 civilians were abducted by suspected LRA forces in attacks on Bamundanga, Lolo, Balipio and Mulundu, DRC, during the month of May 2011.",3.58,25.52,#2563A3
1/21/10,"On January 21st, 2010, a man was killed while travelling on the road from Ngilima to Dungu in DRC by alleged LRA forces.",3.582982,28.4618,#2563A3
6/18/09,"Security forces clashed with LRA forces at Kareo, DRC. During the clash, 2 abducted persons were rescued.",3.5912,29.8404,#2563A3
6/20/09,"Security forces clashed with LRA forces near Awago and Kareo, DRC on June 20th, 2009. Between the two clashes, 3 LRA members were killed, 6 others were captured, and 12 civilians were rescued from LRA captivity.",3.5912,29.8404,#2563A3
6/24/09,"Security forces and LRA forces clashed at Kareo, DRC. 1 LRA member was killed and 1 abducted person was freed by security forces.",3.5912,29.8404,#2563A3
8/7/09,"LRA forces abducted 1 civilian 80 km east of Dungu, DRC, which is near Gangala Na Bodio, DRC.",3.594,29.224,#2563A3
7/25/11,"A 13-year-old boy escaped from LRA captivity during a clash with regional security forces and escaped to Limolo, which is south of Bangadi, DRC, during the week of July 25, 2011.",3.597,27.925,#2563A3
11/1/09,"LRA forces clashed with security forces in the week before November 8th, 2009 west of Dingila, DRC.",3.598,26.521,#2563A3
1/17/11,"A woman who had been with LRA forces for 9 years (since 2002) was released with her 2 very young children who were both fathered by LRA commanders. She was released from LRA captivity near Dungu, DRC.",3.5993,28.5538,#2563A3
7/25/13,"Security forces spotted a group of 12 LRA, who were in search of food, 90 km east of Dungu along the Dungu-Faradje road in the DRC. The two groups exchanged fire during which a 12-year-old Congolese boy was able to escape from his captors.",3.6053,29.2277,#2563A3
3/1/08,"As reported in Dungu, DRC, 1 Congolese and 1 Central African national escaped from the LRA sometime in early March 2008. They estimate the LRA to be about 1200 strong - including dependents - and to hold 120 abductees.",3.60675,28.56441,#2563A3
4/23/08,"As reported on April 23rd, 2008, a large group of LRA forces coming from CAR looted Dungu, DRC, causing the population to flee to the forest.",3.60675,28.56441,#2563A3
7/25/08,"3 armed soldiers who had been with the LRA for over 3 years defected in Dungu, DRC, between July 25th and 26th, 2008.",3.60675,28.56441,#2563A3
9/1/08,"Between September and November 2008, LRA forces killed a total of at least 176 civilians, abducted at least 316 children, and abducted dozens of adults for porters and guides in Haut Uele Province of DRC. They also displaced 17,000 people.",3.60675,28.56441,#2563A3
11/1/08,"LRA forces attacked the market in the town of Dungu, DRC, killing, abducting, looting and burning property. 2 people were killed, and at least 27 civilians were abducted. Security forces attempted to chase the LRA off by firing into the air.",3.60675,28.56441,#2563A3
11/7/08,"On November 7th, 2008, 14 civilians arrived in Dungu, DRC, after being released by the LRA a day before. They had all been abducted during the November 1st, 2008, attack on Dungu. Reportedly 80 civilians were still held by the LRA in Garamba NP.",3.60675,28.56441,#2563A3
12/22/08,"LRA forces abducted a Congolese child and at least 3 men who were fishing near the Dungu River in the DRC on December 22nd, 2008. The exact location of this incident is unknown.",3.60675,28.56441,#2563A3
3/12/09,"1 boy escaped from LRA forces and fled to Dungu, DRC.",3.60675,28.56441,#2563A3
12/15/09,"During the Christmas Massacres, LRA forces killed at least 62 civilians in communities west of Dungu, DRC.",3.60675,28.56441,#2563A3
1/1/10,"Between January 1st and 4th, 2010, LRA forces attacked a number of communities in Haut Uele DRC near Dungu, Ngilima, and Bangadi. Attacks included abductions and killings of civilians, burning of houses, and injury to 2 security forces.",3.60675,28.56441,#2563A3
1/8/10,"Security forces took 2 suspected LRA members into custody after the suspected LRA members attempted an abduction in Dungu, DRC on January 8th, 2010.",3.60675,28.56441,#2563A3
1/13/10,"After 8 LRA members attacked Dungu, DRC on January 10th, 2010, security forces responded and engaged. In the course of this clash 3 civilians were killed and 4 wounded.",3.60675,28.56441,#2563A3
1/14/10,"On January 14th, 2010, suspected LRA forces  abducted 2 civlians on the road to Duru within Dungu, DRC. There might have also been civilian fatalities, but this is unconfirmed.",3.60675,28.56441,#2563A3
1/22/10,"A woman was rescued from LRA captivity by unknown means by security forces in Dungu, DRC, on January 22, 2010.",3.60675,28.56441,#2563A3
1/24/10,"LRA forces and security forces fought just outside of Dungu, DRC, resulting in the death of 4 LRA members, the release of 5 abductees, and the capture of 2 LRA members.",3.60675,28.56441,#2563A3
2/6/10,"A clash between LRA forces and security forces occurred on February 6th, 2010 near Dungu, DRC.",3.60675,28.56441,#2563A3
3/9/10,"LRA members abducted 1 civilian on March 9th, 2010 near Dungu, DRC. He was later released.",3.60675,28.56441,#2563A3
3/9/10,"LRA forces released 1 abducted civilian near Dungu, DRC on March 9th, 2010. GPS approximate.",3.60675,28.56441,#2563A3
3/26/10,"Several LRA combatants were spotted near the Uele river in Dungu, DRC.",3.60675,28.56441,#2563A3
1/30/11,"2 Congolese girls were abducted by LRA forces near Dungu, DRC.",3.60675,28.56441,#2563A3
8/24/12,"A Congolese male of unknown age escaped from LRA forces and fled to Dungu, DRC.",3.60675,28.56441,#2563A3
5/14/13,"An LRA member defected in Dungu, DRC.",3.60675,28.56441,#2563A3
4/8/10,"LRA forces attacked a civilian on the road to Faradje, DRC.",3.6086,29.1818,#2563A3
12/14/09,"This is the 4th incident in the Makombo Massacres. The LRA moved onto Makombo, DRC, and abducted dozens of people, including 3 children in their teens. The total abducted is unknown.",3.6094,27.4734,#2563A3
2/1/11,"Along the road near Gbaga, DRC, a sizable group of LRA attacked a truck killing 1 person, wounding 2, and abducting 15. They proceeded to loot the contents of the truck.",3.6162,28.1586,#2563A3
2/1/11,"LRA forces entered the small town of Gbaga, DRC, on the night of January 31st, 2011, and attacked the civilian population-- they killed 2, wounded 3 and abducted 1. The LRA  forces then looted the community and burned a lorry.",3.6162,28.1586,#2563A3
4/14/13,7 LRA forces ambushed a truck near the Nangume river along the Dungu-Faradje road in the DRC. The assailants shot and wounded 2 men before looting their goods. Many more LRA were seen just off the road. 2 motorcyclists were looted and a 2nd truck shot at.,3.6176,29.2688,#2563A3
4/16/13,"3 armed LRA forces accompanied by several boys looted a truck along the Dungu-Faradje road in the DRC. The assailants looted a tarp, money, bread, and the clothes of the driver. The boys carried the looted goods. The LRA group moved north after the attack",3.6176,29.2688,#2563A3
6/12/11,"Suspected LRA forces attacked 3 civilians along the Dungu-Faradje road in the DRC on June 12th, 2011. 1 civilian was killed, 1 civilian was abducted, and the other was still missing at the time of the report. Their goods were also looted.",3.62,29.248,#2563A3
5/23/09,"Suspected LRA forces killed 1 civilian and burned down 20 homes in Bamokandi, DRC near Dungu in the night from May 23rd to the 24th, 2009.The locals fled the village.",3.62037,28.5799,#2563A3
9/14/09,"Suspected LRA forces were sighted outside of Bamokandi, DRC on September 14th, 2009. There are no other details.",3.62037,28.5799,#2563A3
